{
  "$schema": "https://json-schema.org/draft/2020-12/schema",
  "title": "GatewayConfig",
  "type": "object",
  "required": ["gateway_id", "adapters"],
  "properties": {
    "gateway_id": {"type": "string"},
    "adapters": {
      "type": "array",
      "items": {
        "type": "object",
        "required": ["adapter_id", "adapter_type", "config"],
        "properties": {
          "adapter_id": {"type": "string"},
          "adapter_type": {"type": "string"},
          "config": {"type": "object"}
        }
      }
    },
    "validation": {
      "type": "object"
    },
    "events": {
      "type": "object"
    },
    "aggregates": {
      "type": "object"
    },
    "sinks": {
      "type": "array",
      "items": {
        "type": "object",
        "required": ["sink_type", "config"],
        "properties": {
          "sink_id": {"type": "string"},
          "sink_type": {"type": "string"},
          "status": {"type": "string"},
          "config": {"type": "object"}
        }
      }
    }
  }
}
